{
  "disposition": "READY",
  "governing_intent": "Preserve archive-reading compatibility across endian architectures.",
  "summary": "Technically large but cohesive work with frozen compatibility and observable acceptance.",
  "owner_clarifications": [],
  "implementation_unknowns": [
    "Locate reusable endian helpers and derive compatible internal buffering changes."
  ],
  "independent_decision_centers": [
    "Portable archive-reading compatibility."
  ],
  "semantic_split_recommendation": [],
  "verification_assessment": "One verdict from the golden corpus, API/CLI compatibility, error-code and memory-bound tests on both runners.",
  "expected_rework_locality": "HIGH",
  "material_risks": [],
  "next_action": "Hand the cohesive migration to an implementation agent under the stated authority.",
  "rationale": "All implementation activities establish one compatibility guarantee. Forty modules and a large diff do not create independent decision centers."
}
